{
  "version": "3.0",
  "type": "academic_halachic_reference",
  "heritage_id": "syrian",
  "name": "Syrian",
  "aliases": [
    "Halabi",
    "Shami",
    "Syrian Jews",
    "Halabi / Halebi / Chalabi (Aleppo)",
    "Shami / Shamie (Damascus)",
    "Aram Soba (Aram Tzova) Jewry",
    "SY (colloquial, US)"
  ],
  "database_scope": {
    "purpose": "Sourced reference for Syrian minhagim and halachic practice. It records what the cited sources say, with a confidence level for each entry, and is not a psak.",
    "coverage_note": "24 sourced topics and 8 distinctive customs, compiled from the cited sources in October 2026. Each entry carries a confidence level (well-attested, disputed, regional, needs-review). 15 topics have no community-specific source and are listed under 'gaps' rather than filled with generic text."
  },
  "identity": {
    "primary_origin": "Aleppo and Damascus in Syria",
    "secondary_centers": [
      "Safed and Jerusalem (close ties from the 16th century)",
      "Brooklyn, New York",
      "Deal, New Jersey"
    ]
  },
  "languages": [
    "Arabic: the community grew from native Arabic-speaking (Musta'arabi) Jews and Sephardi exiles",
    "Judeo-Arabic: the Pesach table exchange and the Judeo-Arabic translation of the Torah (Sharh)"
  ],
  "subgroups": [
    {
      "name": "Aleppo (Halabi)",
      "note": "Jews of Aleppo (Halab, Hebrew Aram Soba). The community was formed from native Arabic-speaking (Musta'arabi) Jews and Sephardi exiles who came after 1492. Most of the documented customs here come from this subgroup, mainly through the minhag book Derech Eretz as cited by Rabbi Eli Mansour."
    },
    {
      "name": "Damascus (Shami)",
      "note": "Jews of Damascus (al-Sham). Historically they had separate synagogues and schools and married separately from Halabis. Their documented customs here are limited to a separate bakashot order and 16th-century legal customs. Modern Shami ritual differences are mostly undocumented in the sources consulted."
    },
    {
      "name": "US diaspora (Brooklyn / Deal, NJ)",
      "note": "Size estimates vary: 75,000 (Wikipedia, 'Syrian Jews'); about 90,000 for the New York and New Jersey communities in 2007 (Wikipedia, 'Syrian Jewish communities of the United States'); or 'more than 50,000, mostly in Brooklyn and Deal, N.J.' by the community's own count (JTA, 2004). Centered around Ocean Parkway, Brooklyn, with a satellite community in Deal, NJ. Halabi and Shami descendants now intermarry freely. Shared institutions include the 1935 Edict, the 1964 'Shir Ushbaha Hallel VeZimrah' pizmonim book and the rulings of Hakhamim Kassin, Ben Haim and Mansour."
    }
  ],
  "historical_background": {
    "timeline": [
      {
        "period": "Biblical tradition",
        "event": "The community identifies Aleppo with Aram Soba and Damascus with Aram Dameseq, both conquered by King David.",
        "halachic_impact": "This is the basis for treating Aleppo as having partial Land-of-Israel status for some laws. Per Wikipedia only, some such laws extend to Aleppo but not Damascus. Needs review."
      },
      {
        "period": "16th century",
        "event": "Sephardi exiles arrive after 1492. Damascus has close ties to Safed and Jerusalem, and in doubtful cases local practice relied on 'minhag Dameshek'.",
        "halachic_impact": "Separate Sephardi groups in Aleppo, the 'Kahal Kadosh Sepharadim', kept Spanish customs such as the extra Chanukah candle. Damascus ketubah and inheritance customs were cited across the region."
      },
      {
        "period": "17th century",
        "event": "The Sabbatean movement wins followers in Syria.",
        "halachic_impact": "According to Rabbi Mansour, the Hakhamim cut back messianic references in the liturgy, which is why the four 'Halevi' stanzas of Lecha Dodi are omitted."
      },
      {
        "period": "1908–1920s",
        "event": "Mass emigration to New York, first to Manhattan, then Brooklyn.",
        "halachic_impact": "Halabi and Shami immigrants first kept separate synagogues, schools and marriages."
      },
      {
        "period": "1935",
        "event": "Chief Rabbi Jacob Kassin and four rabbis, including Bet Din head Hakham Haim Tawil, issue the Proclamation (Edict) on converts. It was clarified in 1946 and 1972 and reaffirmed in 1984.",
        "halachic_impact": "The community does not accept converts for marriage. In current practice this has been extended into a blanket ban."
      },
      {
        "period": "1964",
        "event": "'Shir Ushbaha Hallel VeZimrah' (the Red pizmonim book) is published in Jerusalem for the Aleppo community of Brooklyn.",
        "halachic_impact": "It became the community's standard pizmonim collection and the reference for the weekly maqam."
      },
      {
        "period": "1970s–present",
        "event": "Year-round settlement in Deal, NJ: in the 1970s it 'lured tens of families to buy homes in the Deal area', and it now has 'hundreds of families in the winter months and thousands in the summer' (Gina Doueck, Conversations 29). According to Doueck, 'The last wave of immigrants arrived in the 1990s', and 'the number of Jews in Syria today is five or fewer persons.' A trend toward Haredi practice follows.",
        "halachic_impact": "Gina Doueck (Conversations 29) contrasts 'the traditional, more practical approach' of Hakhamim Haim Tawil (1860–1942), Matloub Abadi (1887–1970) and Jacob Kassin (1900–1994) with Haredi practices brought in from Lakewood and Israel, such as 'full-time learning in kollel, women using wigs for hair covering instead of the traditional snood'."
      }
    ]
  },
  "core_halachic_authorities": {
    "primary_codes": [
      "Shulchan Aruch (Maran R. Yosef Karo)",
      "Writings and customs of the Arizal (R. Yitzhak Luria), followed where they differ from Maran (e.g., Kapparot)"
    ],
    "major_rishonim_base": [
      "Rambam (historically influential in Aleppo; some Halab prayer books follow his Chanukah blessing text)",
      "Rashba (cited as opposing Kapparot)"
    ],
    "later_poskim": [
      "Ben Ish Hai (R. Yosef Haim of Baghdad)",
      "Kaf HaHaim (R. Yaakov Haim Sofer)",
      "Eretz Haim (R. Haim Sutton of Aleppo)",
      "Hacham Eliyahu Hamoui (Aleppo)",
      "Derech Eretz (minhag book of the Aleppo community)",
      "Hacham Ovadia Yosef / Yalkut Yosef",
      "Hacham Bension Abba Shaul (Or Le'Sion)",
      "Hakham Jacob S. Kassin (Chief Rabbi, Brooklyn)",
      "Hakham Baruch Ben Haim (Brooklyn)",
      "Rabbi Eli J. Mansour (Edmond J. Safra Synagogue, Brooklyn; Ohel Yaacob, Deal)"
    ],
    "decision_principle": "Shulchan Aruch as the base. Kabbalistic practice of the Arizal, as transmitted by the Ben Ish Hai and Kaf HaHaim, is followed where the two conflict. Specific Aleppo customs recorded in Derech Eretz and the Halab siddurim are kept where they exist. Rabbi Mansour states: 'We, of course, treat all the customs and practices of the Arizal with the utmost seriousness and respect, as they reflect the customs of the Kabbalistic tradition, which we follow.'"
  },
  "runtime": {
    "lens_key": "Syrian",
    "practice_baseline": "Practice rests on the Shulchan Aruch read through the Arizal, the Ben Ish Hai and the Kaf HaHaim, together with specific Aleppo customs (Derech Eretz, Eretz Haim) as taught in the US by Hakhamim Kassin, Ben Haim and Rabbi Eli Mansour.",
    "parameters": []
  },
  "halacha_index": [
    {
      "index": "halacha.1",
      "category": "Prayer",
      "topic": "Nusach and liturgical base",
      "summary": "Syrian synagogues pray from 'Aram Soba' (Aleppo) siddurim. The Kol Yaakob siddur is cited as a source for Halab custom. The rite is Sephardi and Kabbalistic, following the Arizal where he differs from the Shulchan Aruch.",
      "common_practices": [
        "Siddurim 'keminhag Aram Soba' in Brooklyn synagogues",
        "Kol Yaakob weekday siddur cited as a record of Halab custom",
        "Arizal's customs followed over Maran where they conflict"
      ],
      "variants": [
        {
          "subgroup": "Damascus (Shami)",
          "practice": "Its liturgy is reported to differ from Aleppo's 'in some details, mostly because of its greater proximity to the Holy Land'.",
          "source": "Wikipedia, 'Syrian Jews'"
        }
      ],
      "source": "Rabbi Eli J. Mansour, 'Select Halachot on Yom Kippur' (DailyHalacha archive, 2015), section 'The Custom of Kapparot'; Hanna Zemer, 'Nusach Aram Soba – Halab she-be-Flatbush' (1995)",
      "source_url": "http://g-ddirecttorah.com/PDF/YomKippurHalachot2015.pdf",
      "confidence": "needs-review",
      "review_notes": "The Zemer essay was seen only as a search excerpt. The detailed textual differences between the Aleppo and Damascus siddurim are a gap.",
      "references": [
        {
          "title": "Page 1 of 29 From The Archives of www.DAILYHALACHA.com",
          "url": "http://g-ddirecttorah.com/PDF/YomKippurHalachot2015.pdf"
        },
        {
          "title": "Syrian Jews",
          "url": "https://en.wikipedia.org/wiki/Syrian_Jews"
        },
        {
          "title": "History of the Jews in The Land of Israel: History of the Jews in Syria",
          "url": "http://historyofthejewsinisrael.blogspot.com/2016/08/history-of-jews-in-syria.html"
        }
      ],
      "topic_he": "נוסח ובסיס ליטורגי",
      "summary_he": "בתי הכנסת הסוריים מתפללים מסידורי \"ארם צובא\" (חלב). הסידור \"קול יעקב\" מצוטט כמקור למנהג חלב. הנוסח ספרדי וקבלי, והולך אחרי האר\"י כשהוא חולק על השולחן ערוך."
    },
    {
      "index": "halacha.2",
      "category": "Shabbat",
      "topic": "Kabbalat Shabbat order (Halab)",